{
  "id": "mint-editorial-cv",
  "displayName": "Mint Editorial CV",
  "sourceProject": "cv-reference",
  "sourceRevision": "revision-008",
  "sourceCommit": "53f0b3a5a893d28075ffed8b061bb5ebca8aa630",
  "className": "MintEditorialCvTemplate",
  "specClass": "com.demcha.examples.cv.MintEditorialCvSpec",
  "specProviderClass": "com.demcha.examples.cv.MintEditorialCvSpecProvider",
  "docKind": "cv",
  "schemaVersion": "1.0.0",
  "publishedAt": "2026-05-19T08:05:26.347Z",
  "fonts": [
    {
      "role": "heading",
      "family": "Poppins",
      "fontName": "POPPINS",
      "source": "graphcompose-bundled",
      "status": "ok",
      "registration": "default-fonts",
      "notes": null
    },
    {
      "role": "body",
      "family": "Poppins",
      "fontName": "POPPINS",
      "source": "graphcompose-bundled",
      "status": "ok",
      "registration": "default-fonts",
      "notes": null
    },
    {
      "role": "fallback",
      "family": "Helvetica",
      "fontName": "HELVETICA",
      "source": "standard14",
      "status": "ok",
      "registration": "standard14",
      "notes": null
    }
  ],
  "dependencies": {
    "graphcompose": "1.6.0",
    "jackson": "2.17.2"
  }
}
